"823.8","015495658","Monograph","Language material ; Text","Volume","GBB032000","","9781904808428","Carroll, Lewis","1832-1898","person","author","Tenniel, John, 1820-1914, illustrator [person] ; Carroll, Lewis, 1832-1898, author [person] ; Carroll, Lewis, 1832-1898 [person] ; Thomson, E. Gertrude (Emily Gertrude), illustrator [person] ; Everson, Michael, 1963-, editor [person]","The nursery 'Alice'","Alice's adventures in Wonderland","","","Ireland","Cathair na Mart, Colorado Maigh Eo","Evertype","2010","","12, 2, 69 pages, colour illustrations, 22 cm","YK.2011.a.10694","Alice, (Fictitious character from Carroll)--Juvenile fiction","Children's fiction","English","Originally published, London :Macmillan, 1890",""
"823.8","015506444","Monograph","Language material ; Text","Volume","GBB038137","","9781904808442","Gorham, J. C., Mrs","","person","author","Tenniel, John, 1820-1914, illustrator [person] ; Gorham, J. C., Mrs, author [person] ; Carroll, Lewis, 1832-1898 [person] ; Everson, Michael, 1963- [person]","Alice's adventures in Wonderland : retold in words of one syllable","Alice's adventures in Wonderland","","","Ireland","Cathair na Mart, Colorado Maigh Eo","Evertype","2010","","xi, 94 pages, illustrations, 22 cm","YK.2011.a.9639","Alice, (Fictitious character from Carroll)--Juvenile fiction","Children's fiction ; Fantasy","English","Originally published, New York : A.L. Burt Co, 1905",""
"823.8","015534805","Monograph","Language material ; Text","Volume","GBB052257","","9780099541547","Carroll, Lewis","1832-1898","person","","Carroll, Lewis, 1832-1898 [person]","Alice's adventures in Wonderland : and, Through the looking-glass","Through the looking-glass","Vintage classics","","England","London","Vintage Classic","2010","","1 volume, 18 cm","","Alice, (Fictitious character from Carroll)--Fiction ; Fantasy fiction, English","Fiction","English","",""
"823.8","015537673","Monograph","Language material ; Text","Volume","GBB132746","","9781905716845","Carroll, Lewis","1832-1898","person","","Carroll, Lewis, 1832-1898 [person] ; Tenniel, John, 1820-1914 [person]","The complete works","Complete illustrated works ; Works","","","England","London","Collector's Library ; Omnibus","2010","","530 pages, illustrations, 26 cm","YC.2011.b.272","Alice, (Fictitious character from Carroll)--Fiction","Fiction","English","'including Alice's adventures in wonderland ; and, Through the looking-glass / with illustrations by John Tenniel ; & Sylvie and Bruno ; The hunting of the snark, and other verse, rhymes, puzzles, and various stories.' ; Includes index",""
"823.8","015553470","Monograph","Language material ; Text","Volume","GBB139171","","9781600105968","Carroll, Lewis","1832-1898","person","author","Carroll, Lewis, 1832-1898, author [person] ; Eisinger, Justin [person] ; Frison, Jenny, illustrator [person]","Alice's adventures in Wonderland","","","","United States of America","San Diego, California","","2010","","205 pages, colour illustrations, 24 cm","YK.2011.a.6799","Alice, (Fictitious character from Carroll)--Juvenile fiction","Children's fiction","English","",""
"823.8","015567633","Monograph","Language material ; Text","Volume","GBB068548","","9781904808466","Carroll, Lewis","1832-1898","person","author","Carroll, Lewis, 1832-1898, author [person] ; Tenniel, John, 1820-1914, illustrator [person] ; Roberts, Selyf [person]","Anturiaethau Alys yng Ngwlad Hud","Alice's adventures in Wonderland. Welsh","","","Ireland","Cathair na Mart, Colorado Maigh Eo","Evertype","2010","","ix, 123 pages, illustrations, 22 cm","YK.2011.a.41972","Alice, (Fictitious character from Carroll)--Juvenile fiction","Children's fiction ; Fantasy","Welsh","",""
"823.8","015567634","Monograph","Language material ; Text","Volume","GBB068549","","9781904808480","Carroll, Lewis","1832-1898","person","author","Carroll, Lewis, 1832-1898, author [person] ; Tenniel, John, 1820-1914, illustrator [person] ; Stowell, Brian, translator [person]","Contoyryssyn Ealish ayns Çheer ny Yindyssyn","Alice's adventures in Wonderland. Manx","","","Ireland","Cathair na Mart, Colorado Maigh Eo","Evertype","2010","","viii, 132 pages, illustrations, 22 cm","YK.2011.a.19988","Alice, (Fictitious character from Carroll)--Juvenile fiction ; Carroll, Lewis, 1832-1898--Translations into Manx","Children's fiction ; Fantasy ; Translations into Manx","Manx","",""
"823.8","015567851","Monograph","Language material ; Text","Volume","GBB074538","","9780007350827","Carroll, Lewis","1832-1898","person","author","Carroll, Lewis, 1832-1898, author [person]","Alice's adventures in Wonderland","","","","England","London","Collins Classics","2010","","viii, 158 pages, illustrations, 18 cm","YK.2010.a.17147","","","English","",""
"823.8","015568603","Monograph","Language material ; Text","Volume","GBB072200","","9781904808459","Carroll, Lewis","1832-1898","person","author","Carroll, Lewis, 1832-1898, author [person] ; Tenniel, John, 1820-1914, illustrator [person] ; Everson, Michael, 1963-, editor [person] ; Zimmermann, Antonie, translator [person]","Alice's Abenteuer im Wunderland","Alice's adventures in Wonderland. German","","","Ireland","Cathair na Mart, Colorado Maigh Eo","Evertype","2010","","viii, 131 pages, illustrations, 22 cm","YK.2011.a.9105","Carroll, Lewis, 1832-1898--Translations into German","Translations into German","German","Originally published, Leipzig : Hartknoch, 1869",""
"823.8","015576510","Monograph","Language material ; Text","Volume","GBB152106","","9780007350933","Carroll, Lewis","1832-1898","person","author","Carroll, Lewis, 1832-1898, author [person]","Through the looking glass","","Collins classics","","England","London","Harper","2010","","viii, 178 pages, illustrations, 18 cm","YK.2011.a.11452","Alice, (Fictitious character from Carroll)--Juvenile fiction","Children's fiction","English","",""
"823.8","015584948","Monograph","Language material ; Text","Volume","GBB076798","","9781904808527","Carroll, Lewis","1832-1898","person","author","Carroll, Lewis, 1832-1898, author [person] ; Tenniel, John, 1820-1914, illustrator [person] ; Bué, Henri, translator [person]","Les adventures d'Alice au pays des merveilles","Alice's adventures in Wonderland. French","","","Ireland","Cathair na Mart, Colorado Maigh Eo","Evertype","2010","","viii, 126 pages, illustrations, 22 cm","","Alice, (Fictitious character from Carroll)--Juvenile fiction","Children's fiction","French","",""
"823.8","015601317","Monograph","Language material ; Text","Volume","GBB084619","","9781904955726","Davies, Mark","1955-","person","","Davies, Mark, 1955- [person]","Alice in waterland : Lewis Carroll and the River Thames in Oxford","","","","England","Oxford","Signal","2010","","xiv, 129 pages, illustrations, 23 cm","YK.2011.a.19761","Thames River (England)--Description and travel ; Carroll, Lewis, 1832-1898--Characters ; Carroll, Lewis, 1832-1898--Travel--England--Thames River","","English","",""
"823.8","015631821","Monograph","Language material ; Text","Volume","GBB179340","","9781845493196","Bradley, Elissa","","person","","Bradley, Elissa [person]","Alice's adventures in Wonderland and Through the looking glass : a Victorian satire?","","","","England","Bury St Edmunds","Arima Pub","2008","","83 pages, 21 cm","YK.2011.a.18616","Carroll, Lewis, 1832-1898","","English","",""
"823.8","015653266","Monograph","Language material ; Text","Volume","","","9783643104700","Zirker, Angelika","","person","","Zirker, Angelika [person]","Der Pilger als Kind : Spiel, Sprache und Erlösung in Lewis Carrolls 'Alice'-Büchern","","Religion und Literatur = Religion and Literature","Band 2 [Religion und Literatur = Religion and Literature]","Germany","Berlin","","2010","","ix, 415 pages, 24 cm","YF.2013.a.9235","Play (Philosophy) ; Carroll, Lewis, 1832-1898--Themes, motives, etc ; Children's stories, English--History and criticism ; Carroll, Lewis, 1832-1898--Language ; Carroll, Lewis, 1832-1898--Criticism and interpretation","","English ; German","",""
"823.8","015663570","Monograph","Language material ; Text","Volume","GBB0B8931","","9780195396195","Winchester, Simon","","person","","Winchester, Simon [person]","The Alice behind Wonderland","","","","United States of America","New York","Oxford University Press","2011","","110 pages, 1 illustration, 22 cm","YC.2012.a.13620","Hargreaves, Alice Pleasance Liddell, 1852-1934 ; Authors, English--19th century--Biography ; Carroll, Lewis, 1832-1898","Biography","English","Includes index",""
"823.8","015685915","Monograph","Language material ; Text","Volume","GBB0D1181","","9781854379573","Carroll, Lewis","1832-1898","person","author","Carroll, Lewis, 1832-1898, author [person] ; Jansson, Tove, illustrator [person]","Alice's adventures in Wonderland","","","","England","London","Tate","2011","","110 pages, illustrations (some colour), 24 cm","YK.2011.a.33960","Alice, (Fictitious character from Carroll)--Juvenile fiction","Children's fiction ; Fantasy","English","",""
"823.8","015688741","Monograph","Language material ; Text","Volume","GBB1A9742","","9781904633327","Carroll, Lewis","1832-1898","person","author","Carroll, Lewis, 1832-1898, author [person] ; Tenniel, John, 1820-1914, illustrator [person] ; Carroll, Lewis, 1832-1898 [person]","Alices's adventures in Wonderland : & Through the looking glass, and what Alice found there","Alices's adventures in Wonderland ; Novels. Selections ; Through the looking-glass","","","England","London","Collector's Library","2004","","283 pages, illustrations, 16 cm","YK.2011.a.30227","","","English","",""
"823.8","015702197","Monograph","Language material ; Text","Volume","GBB0E0625","","9781904808619","Carroll, Lewis","1832-1898","person","author","Carroll, Lewis, 1832-1898, author [person] ; Tenniel, John, 1820-1914, illustrator [person] ; Nonnen, Emily, 1812-1905, translator [person]","Alices äventyr i Sagolandet","Alice's adventures in Wonderland. Swedish","","","Ireland","Cathair na Mart, Colorado Maigh Eo","Evertype","2010","","xvi, 131 pages, illustrations, 22 cm","","Alice, (Fictitious character from Carroll)--Juvenile fiction","Children's fiction","Swedish","Translated from the English",""
"823.8","015717201","Monograph","Language material ; Text","Volume","GBB0E9589","","9781904808558","Carroll, Lewis","1832-1898","person","author","Carroll, Lewis, 1832-1898, author [person] ; Tenniel, John, 1820-1914, illustrator [person] ; Pietrocòla-Rossetti, T. (Teodorico), translator [person] ; Cimarosti, Marco, editor [person]","Le avventure di Alice nel paese delle meraviglie","Alice's adventures in Wonderland. Italian","","","Ireland","Cathair na Mart, Colorado Maigh Eo","Evertype","2010","","xii, 123 pages, illustrations, 22 cm","","Alice, (Fictitious character from Carroll)--Juvenile fiction","Children's fiction","Italian","Translated from the English",""
"823.8","015717203","Monograph","Language material ; Text","Volume","GBB0E9591","","9781904808626","Carroll, Lewis","1832-1898","person","author","Carroll, Lewis, 1832-1898, author [person] ; Tenniel, John, 1820-1914, illustrator [person] ; Hahn, Reinhard F., translator [person]","Alice ẹhr Ẹventüürn in't Wunnerland","Alice's adventures in Wonderland. Low German","","","Ireland","Cathair na Mart, Colorado Maigh Eo","Evertype","2010","","x, 129 pages, illustrations, 22 cm","","Alice, (Fictitious character from Carroll)--Juvenile fiction","Children's fiction","Low German","Translated from the English",""
"823.8","015776064","Monograph","Language material ; Text","Volume","GBB136856","","9780415896672","Susina, Jan","","person","","Susina, Jan [person]","The place of Lewis Carroll in children's literature","","Children's literature and culture","","England","London","Routledge","2011","","1 volume, illustrations, portraits","","Carroll, Lewis, 1832-1898--Influence ; Children's literature, English--History and criticism","","English","Originally published: 2010",""
"823.8","015803002","Monograph","Language material ; Text","Volume","GBB216328","","9780956527752","Carroll, Lewis","1832-1898","person","","Carroll, Lewis, 1832-1898 [person]","Alice's adventures in Wonderland : and, Through the looking glass","Alice in Wonder land : Through the looking glass ; Through the looking-glass","Bibliolis classics","","England","London","Bibliolis","2010","Bibliolis classics edition","208 pages, 21 cm","H.2011/.10284","Alice, (Fictitious character from Carroll)--Fiction ; Fantasy fiction, English","Fiction","English","'Alice in Wonderland first published 1865. Through the looking glass first published 1872'--T.p. verso",""
"823.8","015805281","Monograph","Language material ; Text","Volume","GBB157195","","9781554810390","Carroll, Lewis","1832-1898","person","","Carroll, Lewis, 1832-1898 [person] ; Kelly, Richard [person]","Alice's adventures in Wonderland (1865)","","","","Canada ; England","London ; Peterborough, Ontario","Broadview ; Eurospan","2011","New edition, editor, Richard Kelly","344 pages, illustrations, 22 cm","YK.2011.a.41120","Alice, (Fictitious character from Carroll)--Fiction","Fantasy ; Fiction","English","",""
"823.8","015808649","Monograph","Language material ; Text","Volume","GBB158829","","9780230755383","Carroll, Lewis","1832-1898","person","author","Carroll, Lewis, 1832-1898, author [person] ; Tenniel, John, 1820-1914, illustrator [person]","Alice's adventures in Wonderland","","","","England","London","Macmillan","2011","","ii, 196 pages, colour illustrations, 29 cm","YK.2012.b.4508","Alice, (Fictitious character from Carroll)--Juvenile fiction","Children's fiction","English","",""
"823.8","015808650","Monograph","Language material ; Text","Volume","GBB158830","","9780230755413","Carroll, Lewis","1832-1898","person","author","Carroll, Lewis, 1832-1898, author [person] ; Tenniel, John, 1820-1914, illustrator [person]","Through the looking-glass : & what Alice found there","","","","England","London","Macmillan","2011","","236 pages, colour illustrations, 29 cm","YK.2012.b.4506","Alice, (Fictitious character from Carroll)--Juvenile fiction","Children's fiction","English","",""
"823.8","015818708","Monograph","Language material ; Text","Volume","GBB227885","","9781907360367","Carroll, Lewis","1832-1898","person","author","Carroll, Lewis, 1832-1898, author [person] ; Tenniel, John, 1820-1914, illustrator [person] ; Carroll, Lewis, 1832-1898 [person]","Alice's adventures in Wonderland : &, Through the looking-glass and what alice found there","Alice's adventures in Wonderland ; Novels. Selections ; Through the looking-glass","Collector's library in colour","","England","London","Collector's Colour Library","2011","","286 pages, illustrations, 16 cm","YK.2011.a.40825","Imaginary places--Juvenile fiction ; Children's stories, English ; Alice, (Fictitious character from Carroll)--Juvenile fiction","Children's fiction","English","'Alice's adventures in wonderland was first published in 1865 ; Through the looking glass and what alice found there was first published in 1871'--T.p. verso ; 'Complete & unabridged ; 'New edition in colour'--Cover sticker",""
"823.8","015826528","Monograph","Language material ; Text","Volume","GBB172750","","9781841939735","Carroll, Lewis","1832-1898","person","","Carroll, Lewis, 1832-1898 [person]","Alice in Wonderland","","","","England","London","Arcturus","2011","","1 volume, illustrations, 30 cm","","Alice, (Fictitious character from Carroll)--Juvenile fiction","Children's fiction","English","",""
"823.8","015826830","Monograph","Language material ; Text","Volume","GBB173052","","9781904808640","Carroll, Lewis","1832-1898","person","author","Carroll, Lewis, 1832-1898, author [person] ; Fleemin, Sandy, translator [person]","Ailice's àventurs in Wunnerland","Alice's adventures in Wonderland. Scots","","","Ireland","Cathair na Mart ; Westport","Evertype","2011","","xiv, 123 pages, illustrations, 22 cm","YK.2012.a.10170","Alice, (Fictitious character from Carroll)--Juvenile fiction","Children's fiction","Scots","",""
"823.8","015846849","Monograph","Language material ; Text","Volume","GBB183853","","9781606600146","Carroll, Lewis","1832-1898","person","author","Carroll, Lewis, 1832-1898, author [person] ; Rountree, Harry, 1878-1950, illustrator [person]","Alice's adventures in Wonderland","","","","United States of America","New York","Calla","2011","","247 pages, colour illustrations, 26 cm","YK.2012.b.7490","Alice, (Fictitious character from Carroll)--Juvenile fiction","Children's fiction","English","This edition originally published: London : Thomas Nelson & Sons, 1901",""
"823.8","015851194","Monograph","Language material ; Text","Volume","GBB186047","","9780486482040","","","","","Menges, Jeff A. [person]","Alice illustrated : 110 images from the classic tales of Lewis Carroll","","","","United States of America","Mineola, New York ; Newton Abbot","David & Charles ; Dover","2011","","1 volume, illustrations, 28 cm","","Carroll, Lewis, 1832-1898--Illustrations","","English","",""
"823.8","015865817","Monograph","Language material ; Text","Volume","GBB195331","","9780203869314 ; 9780415808903","Susina, Jan","","person","","Susina, Jan [person]","The place of Lewis Carroll in children's literature","","Children's literature and culture","","England","London","Routledge","2011","","1 volume","","Carroll, Lewis, 1832-1898--Influence ; Carroll, Lewis, 1832-1898--Criticism and interpretation ; Children's literature, English--History and criticism","","English","Originally published: 2010",""
"823.8","015890665","Monograph","Language material ; Text","Volume","GBB1A9027","","9781904808633","Evans, Florence Adèle","","person","","Wheelan, Albertine Randall [person] ; Evans, Florence Adèle [person]","Alice's adventures in Pictureland : a tale inspired by Lewis Carroll's Wonderland","","","","Ireland","Cathair na Mart, Colorado Mhaigh Eo","Evertype","2011","","viii, 139 pages, illustrations, 22 cm","YK.2012.a.17261","Carroll, Lewis, 1832-1898--Parodies, imitations, etc","Children's fiction ; Fantasy ; Parody","English","",""
"823.8","015894376","Monograph","Language material ; Text","Volume","GBB1B0049","","9780141197302","Carroll, Lewis","1832-1898","person","author","Carroll, Lewis, 1832-1898, author [person] ; Kusama, Yayoi, illustrator [person]","Alice's adventures in Wonderland","","","","England","London","Penguin","2012","","181 pages, illustrations, 24 cm","YK.2012.a.25730","Alice, (Fictitious character from Carroll)--Fiction","Fiction","English","",""
"823.8","015904546","Monograph","Language material ; Text","Volume","GBB1B6835","","9781904808695","Carroll, Lewis","1832-1898","person","author","Carroll, Lewis, 1832-1898, author [person] ; Tenniel, John, 1820-1914, illustrator [person] ; Everson, Michael, 1963-, editor [person] ; Carruthers, Clive Harcourt, translator [person]","Alicia in terra mirabili","Alice's adventures in Wonderland. Latin","","","Ireland","Cathair na Mart ; Colorado Mhaigh Eo ; Westport","Evertype","2011","","xviii, 157 pages, illustrations, 22 cm","YK.2012.a.21413","Alice, (Fictitious character from Carroll)--Fiction","Fantasy ; Fiction ; Young adult fiction","Latin","",""
"823.8","015955243","Monograph","Language material ; Text","Volume","GBB1C3524","","9780141389820","Carroll, Lewis","1832-1898","person","","Kusama, Yayoi [person] ; Carroll, Lewis, 1832-1898 [person]","Lewis Carrol's Alice's adventures in Wonderland","Alice's adventures in Wonderland","","","England","London","Penguin","2012","","1 volume, illustrations, 35 cm","","Alice, (Fictitious character from Carroll)--Fiction","Fiction","English","",""
"823.8","015987065","Monograph","Language material ; Text","Volume","GBB1E0210","","9781843652014","Carroll, Lewis","1832-1898","person","","Foreman, Michael, 1938- [person] ; Carroll, Lewis, 1832-1898 [person]","Alice's adventures in Wonderland","","","","England","London","Pavilion Children's","2012","","1 volume, colour illustrations, 21 cm","","Alice, (Fictitious character from Carroll)--Juvenile fiction","Children's fiction","English","",""
"823.8","015998618","Monograph","Language material ; Text","Volume","GBB1E6486","","9781841653778","Bullen, Annie","","person","author","Wood, Abbie, editor [person] ; Carroll, Lewis, 1832-1898 [person] ; Bullen, Annie, author [person]","Alice : in her own words","Alice's adventures in Wonderland ; Through the looking-glass","","","England","Stroud, Gloucestershire","Pitkin","2015","","80 pages, 13 cm","YKL.2017.a.2095","Carroll, Lewis, 1832-1898--Themes, motives ; Carroll, Lewis, 1832-1898--Characters ; Carroll, Lewis, 1832-1898--Quotations ; Carroll, Lewis, 1832-1898--Friends and associates","Quotation or maxim","English","",""
"823.8","016010530","Monograph","Language material ; Text","Volume","GBB204793","","9781904808800","Carroll, Lewis","1832-1898","person","author","Carroll, Lewis, 1832-1898, author [person] ; Tenniel, John, 1820-1914, illustrator [person] ; Morrison-Smyth, Anne [person]","Alice's carrànts in Wunnerlan","Alice's adventures in Wonderland. Scots","","","Ireland","Cathair na Mart, Colorado Maigh Eo","Evertype","2011","","viii, 125 pages, illustrations, 22 cm","","Alice, (Fictitious character from Carroll)--Juvenile fiction","Children's fiction","Scots","",""
"823.8","016015907","Monograph","Language material ; Text","Volume","GBB207564","","9781904808824","Carroll, Lewis","1832-1898","person","author","Carroll, Lewis, 1832-1898, author [person] ; Tenniel, John, 1820-1914, illustrator [person] ; Jennings, Geraint, translator [person]","L's Aventuthes d'Alice en Êmèrvil'lie","Alice's adventures in Wonderland. Jèrriaise","","","Ireland","Cathair na Mart, Colorado Maigh Eo","Evertype","2012","","x, 133 pages, illustrations, 22 cm","","Alice, (Fictitious character from Carroll)--Juvenile fiction","Children's fiction","Romansh","",""
"823.8","016020684","Monograph","Language material ; Text","Volume","GBB210339","","9781904808831","Carroll, Lewis","1832-1898","person","author","Carroll, Lewis, 1832-1898, author [person] ; Tenniel, John, 1820-1914, illustrator [person] ; Everson, Michael, 1963- [person] ; Theissen, Jack [person]","Dee Erläwnisse von Alive em Wundalaund","Alice's adventures in Wonderland. Low German","","","Ireland","Cathair na Mart, Colorado Maigh Eo","Evertype","2012","","x, 138 pages, illustrations, 22 cm","","Alice, (Fictitious character from Carroll)--Juvenile fiction","Children's fiction","Low German","",""
"823.8","016034178","Monograph","Language material ; Text","Volume","GBB244392","","9781904808787","Carroll, Lewis","1832-1898","person","","Carroll, Lewis, 1832-1898 [person] ; Tenniel, John, 1820-1914 [person]","Alice's adventures in Wonderland","","","","Ireland","Cathair na Mart, Colorado Maigh Eo","Evertype","2011","","xviii, 152 pages, illustrations, 22 cm","","Alice, (Fictitious character from Carroll)--Juvenile fiction","Children's fiction","English","",""
"823.8","016036212","Monograph","Language material ; Text","Volume","GBB218813","","9781904808862","Carroll, Lewis","1832-1898","person","author","Carroll, Lewis, 1832-1898, author [person] ; Tenniel, John, 1820-1914, illustrator [person] ; Broadribb, Donald, 1933-, translator [person]","La aventuroj de Alicio en Mirlando = Alice's adventures in Wonderland in Esperanto","Alice's adventures in Wonderland. Esperanto","","","Ireland","Cathair na Mart, Colorado Maigh Eo","Evertype","2012","","x, 120 pages, illustrations, 22 cm","","Alice, (Fictitious character from Carroll)--Juvenile fiction","Children's fiction","Esperanto","Originally published: 1996",""
"823.8","016043928","Monograph","Language material ; Text","Volume","GBB223027","","9780141199689","Carroll, Lewis","1832-1898","person","author","Carroll, Lewis, 1832-1898, author [person] ; Carroll, Lewis, 1832-1898 [person]","Alice's adventures in Wonderland : and, Through the looking glass","Alice's adventures in Wonderland ; Novels. Selections ; Through the looking-glass","Penguin English library","","England","London","Penguin","2012","","volumes, 246 pages, illustrations, 20 cm","YK.2013.a.9527","Alice, (Fictitious character from Carroll)--Fiction","Fiction","English","",""
"823.8","016051749","Monograph","Language material ; Text","Volume","GBB358465","","9780140624083","Carroll, Lewis","1832-1898","person","author","Carroll, Lewis, 1832-1898, author [person]","Through the looking glass","","Penguin popular classics","","England","London","Penguin","2007","","172 pages, black and white illustrations, 19 cm","YK.2013.a.14900","","","English","",""
"823.8","016054184","Monograph","Language material ; Text","Volume","GBB229564","","9781904808879","Carroll, Lewis","1832-1898","person","author","Carroll, Lewis, 1832-1898, author [person] ; Tenniel, John, 1820-1914, illustrator [person] ; Capron, André, translator [person]","Lès-aventûres d'Alice ô Pèyis dès Mèrvèy","Alice's adventures in Wonderland. Picard","","","Ireland","Cathair na Mart, Colorado Mhaigh Eo","Evertype","2012","","x, 135 pages, illustrations, 22 cm","","Alice, (Fictitious character from Carroll)--Juvenile fiction","Children's fiction","English ; French ; Romansh","",""
"823.8","016054185","Monograph","Language material ; Text","Volume","GBB229565","","9781904808886","Carroll, Lewis","1832-1898","person","author","Carroll, Lewis, 1832-1898, author [person] ; Tenniel, John, 1820-1914, illustrator [person] ; Davies, Simon (Simon F.), translator [person]","La aventuras de Alisia en la pais de mervelias","Alice's adventures in Wonderland. Lingua Franca Nova","","","Ireland","Cathair na Mart, Colorado Mhaigh Eo","Evertype","2012","","x, 122 pages, illustrations, 22 cm","","Alice, (Fictitious character from Carroll)--Juvenile fiction","Children's fiction","Artificial languages ; English","",""
